{
  "version": "1.0",
  "three": {
    "sceneConfigPath": "./drone_config-compact-terrain-fixture.json"
  },
  "pdu": {
    "pduDefPath": "./pdudef.json",
    "wsUri": "ws://127.0.0.1:8765",
    "wireVersion": "v2"
  },
  "ui": {
    "statePanelIntervalMsec": 100,
    "enableAttachedCameras": false,
    "enableMainCameraMouseControl": true
  },
  "stateInput": {
    "mode": "legacy",
    "legacy": {
      "roleMap": {
        "pos": "geometry_msgs/Twist",
        "motor": "hako_mavlink_msgs/HakoHilActuatorControls",
        "status": "hako_msgs/DroneStatus",
        "impulse_collision": "hako_msgs/ImpulseCollision"
      }
    }
  }
}
